sentenceID,sentence,origin,destination,is_valid,difficulty,category,notes
3665,À quelle heure part le premier train de Perpignan pour Aix-en-Provence,Perpignan,Aix-en-Provence,1,medium,complex_question,
7634,Avec mon ami Rémy je voudrais aller de Amiens à Villeurbanne,Amiens,Villeurbanne,1,medium,name_ambiguity,Rémy=prénom
4893,en provenance de angers,,,0,easy,incomplete_dest,missing destination
5027,un billet tour bordo,Tours,Bordeaux,1,hard,misspelling,spelling errors
9543,Quel est le prix d'un aller simple de Villeurbanne à Metz,Villeurbanne,Metz,1,medium,additional_info,with time/passenger info
1349,je me trouve à paris,,,0,easy,incomplete_dest,missing destination
7978,À quelle heure arrive le dernier train de Clermont-Ferrand à Metz,Clermont-Ferrand,Metz,1,medium,complex_question,
3040,je veux aller de paric à villeurbannne,Paris,Villeurbanne,1,hard,misspelling,spelling errors
2482,Paris Bordeaux Montpellier Nice,,,0,medium,ambiguous,too many cities
4800,"florence, clément et moi voulons aller de le havre à paris",Le Havre,Paris,1,hard,name_ambiguity,"Florence/Clément=prénoms, lowercase"
3459,tambour parapluie igloo uniforme parapluie,,,0,easy,garbage,nonsense words
7181,^^&& ^^&&,,,0,easy,garbage,special characters
181,Trajet Limoges Le Mans,Limoges,Le Mans,1,medium,no_markers,
7872,Trajet vers Amiens au départ de Lille,Lille,Amiens,1,medium,inverted_order,
802,Retrouver Lourdes à Paris en partant de Marseille,Marseille,Paris,1,hard,name_ambiguity,Lourdes=prénom
9805,Pouvez-vous me donner les horaires de Nîmes à Metz,Nîmes,Metz,1,easy,standard,
767,De Lille à Montpellier puis Paris,,,0,medium,ambiguous,too many cities
9319,Je dois rejoindre Albert à Bordeaux depuis Grenoble,Grenoble,Bordeaux,1,medium,name_ambiguity,Albert=prénom
3192,Combien coûte un billet de train de Brest à Grenoble,Brest,Grenoble,1,medium,standard,
8768,Quand part le prochain train de Bordeaux vers Villeurbanne,Bordeaux,Villeurbanne,1,medium,standard,
8117,Trajet Le Havre Lille,Le Havre,Lille,1,medium,no_markers,
6601,"avec mes amis rémy et clément, je voudrais aller de amiens à saint-étienne",Amiens,Saint-Étienne,1,hard,name_ambiguity,"Rémy/Clément=prénoms, lowercase"
2865,arrivant de dijon ?,,,0,easy,incomplete_dest,missing destination
302,Direction Lyon en partant de Clermont-Ferrand,Clermont-Ferrand,Lyon,1,medium,inverted_order,
6899,Au départ de Grenoble,,,0,easy,incomplete_dest,missing destination
4876,Perpignan Limoges s'il vous plaît,Perpignan,Limoges,1,medium,no_markers,
5545,wugokijid pawyjalozu dex tenibe fytezy,,,0,easy,garbage,random text
1295,Trajet vers Perpignan au départ de Aix-en-Provence,Aix-en-Provence,Perpignan,1,medium,inverted_order,
1074,Combien coûte un billet de train de Perpignan à Le Havre,Perpignan,Le Havre,1,medium,standard,
8950,retrouver florence à limoges en partant de nîmes,Nîmes,Limoges,1,hard,name_ambiguity,"Florence=prénom, lowercase"
8585,Un aller simple de Lyon à Le Havre,Lyon,Le Havre,1,easy,standard,
9141,Train pour Toulouse Nantes et Lille,,,0,medium,ambiguous,too many cities
8933,Vers Aix-en-Provence au départ de Nîmes,Nîmes,Aix-en-Provence,1,medium,inverted_order,
9339,Origine Toulouse,,,0,easy,incomplete_dest,missing destination
5099,Un billet Metz Aix-en-Provence,Metz,Aix-en-Provence,1,easy,no_markers,
7243,Pour me rendre à Toulouse je pars de Rennes,Rennes,Toulouse,1,medium,inverted_order,
1028,Je me rends à Villeurbanne en provenance de Strasbourg,Strasbourg,Villeurbanne,1,medium,inverted_order,
7674,Commen aler de Saint-Étienn a Tolouse,Saint-Étienne,Toulouse,1,hard,misspelling,spelling errors
7933,je veux aller de villeurbanne à marceille,Villeurbanne,Marseille,1,hard,misspelling,spelling errors
2622,Le Havre Bordeaux aujourd'hui,Le Havre,Bordeaux,1,medium,no_markers,
6383,De Toulouse à Marseille puis Lyon,,,0,medium,ambiguous,too many cities
3413,c'est compliqué ?,,,0,easy,no_intent,random_statements
2581,Un train de Grenoble pour Strasbourg,Grenoble,Strasbourg,1,easy,standard,
1830,Départ Nice,,,0,easy,incomplete_dest,missing destination
5336,trajet tours villeurbann,Tours,Villeurbanne,1,hard,misspelling,spelling errors
221,Retrouver Albert à Amiens en partant de Perpignan,Perpignan,Amiens,1,hard,name_ambiguity,Albert=prénom
407,je pars demain de,,,0,easy,incomplete_grammar,grammatically incomplete
9764,123 **!! billet,,,0,easy,garbage,incoherent mix
8775,je dois travailler demain,,,0,easy,no_intent,off_topic
2127,ordinateur nuage nougat nuage valise,,,0,easy,garbage,nonsense words
8584,SNCF SNCF SNCF SNCF SNCF SNCF SNCF SNCF,,,0,easy,garbage,repetitions
587,un billet nise limoges,Nice,Limoges,1,hard,misspelling,spelling errors
3899,J'aimerais visiter Grenoble ?,,,0,easy,incomplete_origin,missing origin
8178,bonne nuit ?,,,0,easy,no_intent,greetings
4724,bilet lee mans lionne,Le Mans,Lyon,1,hard,misspelling,spelling errors
8799,je dois aller à bordeaux,,,0,easy,incomplete_origin,missing origin
5404,je quitte lille,,,0,easy,incomplete_dest,missing destination
2045,je voudrais un billet de nantes a brest,Nantes,Brest,1,medium,no_capitals,"lowercase, no accents"
8671,Avec mon ami Clément je voudrais aller de Brest à Florence,Brest,Florence,1,medium,name_ambiguity,Clément=prénom
9262,En direction de Rennes,,,0,easy,incomplete_origin,missing origin
6734,Je dois rejoindre Florence à Lyon depuis Toulouse,Toulouse,Lyon,1,medium,name_ambiguity,Florence=prénom
5852,Billet Châlons-en-Champagne Le Havre,Châlons-en-Champagne,Le Havre,1,medium,compound_name,compound name
5437,Y a-t-il des trains directs de Nîmes à Grenoble,Nîmes,Grenoble,1,medium,standard,
6000,Toulouse Marseille Montpellier Paris,,,0,medium,ambiguous,too many cities
9073,un billet aix-en-provence marseille s'il vous plait,Aix-en-Provence,Marseille,1,medium,no_capitals,"lowercase, no accents"
6198,je souhaite me rendre a perpignan depui dijon,Dijon,Perpignan,1,hard,misspelling,spelling errors
8310,Je souhaite me rendre à Limoges depuis Toulon,Toulon,Limoges,1,easy,standard,
8994,un billet monttpellier reims,Montpellier,Reims,1,hard,misspelling,spelling errors
2170,bacago tep wepavije gujinopifa,,,0,easy,garbage,random text
7034,Combien de temps faut-il pour aller de Le Mans à Nantes,Le Mans,Nantes,1,hard,complex_question,
1186,Cap sur Angers,,,0,easy,incomplete_origin,missing origin
718,"Avec mes amis Lourdes et Paris, je voudrais aller de Saint-Étienne à Florence",Saint-Étienne,Florence,1,hard,name_ambiguity,Lourdes/Paris=prénoms
8366,"Avec mes amis Paris et Lourdes, je voudrais aller de Le Mans à Strasbourg",Le Mans,Strasbourg,1,hard,name_ambiguity,Paris/Lourdes=prénoms
7838,Je souhaite me rendre à Brest depuis Toulon,Toulon,Brest,1,easy,standard,
4633,vypa redi nalotepuq,,,0,easy,garbage,random text
1511,Quel jour sommes-nous,,,0,easy,no_intent,general_questions
6932,Quel est l'horaire des trains au départ de Nîmes pour Paris,Nîmes,Paris,1,medium,standard,
3397,Combien coûte un billet de train de Nîmes à Montpellier,Nîmes,Montpellier,1,medium,standard,
9309,Commen aler de Lille a Amienns,Lille,Amiens,1,hard,misspelling,spelling errors
7059,Y a-t-il un train de Le Mans vers Villeurbanne,Le Mans,Villeurbanne,1,easy,standard,
8226,Limoges Aix-en-Provence aller simple,Limoges,Aix-en-Provence,1,medium,no_markers,
8669,Commen aler de Aixx-en-Provence a Bres,Aix-en-Provence,Brest,1,hard,misspelling,spelling errors
1785,Je veux aller de Marseille à Strasbourg,Marseille,Strasbourg,1,easy,standard,
1207,Mon départ est à Angers,,,0,easy,incomplete_dest,missing destination
7412,Je voudrais réserver un billet de Nice pour Limoges,Nice,Limoges,1,medium,standard,
3678,Je voudrais un billet de Clermont-Ferrand à Annecy,Clermont-Ferrand,Annecy,1,easy,standard,
1365,Je dois rejoindre Florence à Limoges depuis Clermont-Ferrand,Clermont-Ferrand,Limoges,1,medium,name_ambiguity,Florence=prénom
3124,Je suis à Toulon,,,0,easy,incomplete_dest,missing destination
9038,Pour aller à Clermont-Ferrand depuis Dijon,Dijon,Clermont-Ferrand,1,medium,inverted_order,
1612,Réservation Aix-en-Provence Montpellier,Aix-en-Provence,Montpellier,1,medium,no_markers,
8758,Je voudrais réserver un billet de Dijon pour Angers,Dijon,Angers,1,medium,standard,
5325,Dijon Marseille aujourd'hui,Dijon,Marseille,1,medium,no_markers,
882,je suis actuellement à grenoble,,,0,easy,incomplete_dest,missing destination
5218,Départ Annecy arrivée Perpignan,Annecy,Perpignan,1,easy,standard,
2541,miroir requin fenêtre orange,,,0,easy,garbage,nonsense words
3854,Êtes-vous marié,,,0,easy,no_intent,general_questions
5092,Retrouver Lourdes à Nantes en partant de Metz,Metz,Nantes,1,hard,name_ambiguity,Lourdes=prénom
9687,Trajet de Amiens vers Le Havre,Amiens,Le Havre,1,easy,standard,
8276,Commen aler de Toulo a Metz,Toulon,Metz,1,hard,misspelling,spelling errors
1094,Je vais à Lyon voir mon ami Florence en partant de Le Havre,Le Havre,Lyon,1,medium,name_ambiguity,Florence=prénom
3897,fovepimemu vypukal pys,,,0,easy,garbage,random text
7611,Mon ami Clément m'attend à Strasbourg je pars de Brest,Brest,Strasbourg,1,medium,name_ambiguity,Clément=prénom
9591,Train de La Roche-sur-Yon à Tours,La Roche-sur-Yon,Tours,1,medium,compound_name,compound name
5035,je suis perdu ?,,,0,easy,no_intent,random_statements
3522,Mon chat est mignon ?,,,0,easy,no_intent,off_topic
1589,"avec mes amis florence et lourdes, je voudrais aller de strasbourg à montpellier",Strasbourg,Montpellier,1,hard,name_ambiguity,"Florence/Lourdes=prénoms, lowercase"
2732,Billet Rennes Lyon Bordeaux,,,0,medium,ambiguous,too many cities
9749,Un billet Amiens Nice pour 2 adultes,Amiens,Nice,1,medium,additional_info,with time/passenger info
9410,@@## ... $$%%,,,0,easy,garbage,special characters
1336,voyage --- !!! Lyon 123,,,0,easy,garbage,incoherent mix
1200,Je voyage avec Rémy et Albert de Limoges vers Clermont-Ferrand,Limoges,Clermont-Ferrand,1,hard,name_ambiguity,Rémy/Albert=prénoms
1865,Retrouver Albert à Florence en partant de Bordeaux,Bordeaux,Florence,1,hard,name_ambiguity,Albert=prénom
3893,"Lourdes, Florence et moi voulons aller de Nîmes à Brest",Nîmes,Brest,1,hard,name_ambiguity,Lourdes/Florence=prénoms
9910,Je veux aller de Aix en Provence à Annecy,Aix-en-Provence,Annecy,1,medium,compound_name,compound name no hyphen
5622,arrivant de bordeaux,,,0,easy,incomplete_dest,missing destination
2205,lulacery pyqihy bulocyqofo wapapa ritibywys,,,0,easy,garbage,random text
3520,En provenance de Rennes,,,0,easy,incomplete_dest,missing destination
2877,Ravi de vous rencontrer ?,,,0,easy,no_intent,greetings
5196,retrouver rémy à florence en partant de lille,Lille,Florence,1,hard,name_ambiguity,"Rémy=prénom, lowercase"
600,Trajet Amiens Port-Boulet,Amiens,Port-Boulet,1,medium,compound_name,compound name
1039,Je veux aller de Nice à Tours,Nice,Tours,1,easy,standard,
2957,Trajet Lille Montpellier,Lille,Montpellier,1,medium,no_markers,
6134,Je veux aller à Strasbourg,,,0,easy,incomplete_origin,missing origin
7959,retrouver clément à clermont-ferrand en partant de angers,Angers,Clermont-Ferrand,1,hard,name_ambiguity,"Clément=prénom, lowercase"
3991,Je me rends à Dijon ?,,,0,easy,incomplete_origin,missing origin
3547,Direction Strasbourg,,,0,easy,incomplete_origin,missing origin
3857,À quelle heure arrive le dernier train de Nîmes à Annecy,Nîmes,Annecy,1,medium,complex_question,
4272,Comment aller de Dijon à Lyon,Dijon,Lyon,1,easy,standard,
2195,retrouver rémy à lyon en partant de villeurbanne,Villeurbanne,Lyon,1,hard,name_ambiguity,"Rémy=prénom, lowercase"
5209,À Aix-en-Provence en partance de Reims,Reims,Aix-en-Provence,1,medium,inverted_order,
5499,Pour aller à Marseille depuis Perpignan,Perpignan,Marseille,1,medium,inverted_order,
2114,Avec mon ami Lourdes je voudrais aller de Aix-en-Provence à Paris,Aix-en-Provence,Paris,1,medium,name_ambiguity,Lourdes=prénom
1188,De Lille à Montpellier puis Lyon,,,0,medium,ambiguous,too many cities
4693,Un billet Lyon Metz,Lyon,Metz,1,easy,no_markers,
5817,igloo kayak cactus lampe,,,0,easy,garbage,nonsense words
4504,Metz Strasbourg demain,Metz,Strasbourg,1,medium,no_markers,
1597,je souhaite me rendre a brest depuis limoges,Limoges,Brest,1,medium,no_capitals,"lowercase, no accents"
1086,mon train préféré est le tgv ?,,,0,easy,no_intent,train_discussion
8969,Y a-t-il un train de Toulouse vers Limoges,Toulouse,Limoges,1,easy,standard,
7794,"Rémy, Albert et moi voulons aller de Aix-en-Provence à Lille",Aix-en-Provence,Lille,1,hard,name_ambiguity,Rémy/Albert=prénoms
9472,À quelle heure part le premier train de Le Havre pour Nice,Le Havre,Nice,1,medium,complex_question,
9456,Je dois rejoindre Lourdes à Toulouse depuis Paris,Paris,Toulouse,1,medium,name_ambiguity,Lourdes=prénom
8015,je souhaite me rendre a saint-étiennne depui perpiggnan,Perpignan,Saint-Étienne,1,hard,misspelling,spelling errors
4244,Je vais à Aix-en-Provence voir mon ami Clément en partant de Rennes,Rennes,Aix-en-Provence,1,medium,name_ambiguity,Clément=prénom
8709,escalier guitare jardin miroir guitare igloo sable,,,0,easy,garbage,nonsense words
7108,Vers Nantes,,,0,easy,incomplete_origin,missing origin
3443,Retrouver Florence à Amiens en partant de Rennes,Rennes,Amiens,1,hard,name_ambiguity,Florence=prénom
9657,"avec mes amis paris et lourdes, je voudrais aller de dijon à clermont-ferrand",Dijon,Clermont-Ferrand,1,hard,name_ambiguity,"Paris/Lourdes=prénoms, lowercase"
6798,J'ai raté mon train ?,,,0,easy,no_intent,train_discussion
4447,Mon ami Rémy m'attend à Florence je pars de Rennes,Rennes,Florence,1,medium,name_ambiguity,Rémy=prénom
1818,Trajet Nice Strasbourg,Nice,Strasbourg,1,hard,misspelling,spelling errors
9617,Réservation Nice Le Havre,Nice,Le Havre,1,medium,no_markers,
7949,Combien coûte un billet de Lille à Dijon,Lille,Dijon,1,medium,additional_info,with time/passenger info
2274,je suis actuellement à dijon ?,,,0,easy,incomplete_dest,missing destination
1233,De Rennes à Toulouse ou peut-être Lille,,,0,medium,ambiguous,contradictions
2972,san vyha sovuze,,,0,easy,garbage,random text
2644,Départ Montpellier arrivée Nice,Montpellier,Nice,1,easy,standard,
5305,Un billet Montpellie Nantez,Montpellier,Nantes,1,hard,misspelling,spelling errors
2679,Un billet Dijon Nice s'il vous plaît,Dijon,Nice,1,easy,standard,
2238,comment aller a lyon depuis aix-en-provence,Aix-en-Provence,Lyon,1,medium,no_capitals,"lowercase, no accents"
4577,"lourdes, florence et moi voulons aller de strasbourg à toulon",Strasbourg,Toulon,1,hard,name_ambiguity,"Lourdes/Florence=prénoms, lowercase"
8581,Un billet pour Reims,,,0,easy,incomplete_origin,missing origin
232,Je dois rejoindre Paris à Tours depuis Marseille,Marseille,Tours,1,medium,name_ambiguity,Paris=prénom
2868,Je veux visiter Montpellier Nantes Rennes,,,0,medium,ambiguous,too many cities
8660,je viens de bordeaux,,,0,easy,incomplete_dest,missing destination
3087,Trajet Nice Le Havre,Nice,Le Havre,1,medium,no_markers,
6225,Un train pour Grenoble ?,,,0,easy,incomplete_origin,missing origin
5511,quel est le prix pour,,,0,easy,incomplete_grammar,grammatically incomplete
5651,Combien coûte un billet de train de Aix-en-Provence à Tours,Aix-en-Provence,Tours,1,medium,standard,
3847,Commen aler de Nante a Bordeaus,Nantes,Bordeaux,1,hard,misspelling,spelling errors
3173,Je vais à Paris voir mon ami Paris en partant de Metz,Metz,Paris,1,medium,name_ambiguity,Paris=prénom
8722,je voudrais un bilet de lionne à le mans,Lyon,Le Mans,1,hard,misspelling,spelling errors
1549,retrouver paris à nantes en partant de perpignan,Perpignan,Nantes,1,hard,name_ambiguity,"Paris=prénom, lowercase"
601,Très bien et vous,,,0,easy,no_intent,greetings
646,Quel est le prix d'un billet de Lyon à Toulon,Lyon,Toulon,1,easy,standard,
49,"Avec mes amis Albert et Paris, je voudrais aller de Metz à Strasbourg",Metz,Strasbourg,1,hard,name_ambiguity,Albert/Paris=prénoms
7544,valise sable requin nuage,,,0,easy,garbage,nonsense words
2791,Je veux aller de Clermont-Ferrand à Nice,Clermont-Ferrand,Nice,1,easy,standard,
6866,Je veux aller de Nantes à Marseille demain matin,Nantes,Marseille,1,medium,additional_info,with time/passenger info
2901,Quel est l'horaire des trains au départ de Lille pour Toulouse,Lille,Toulouse,1,medium,standard,
8547,Je veux aller à Nantes en partant de Rennes,Rennes,Nantes,1,medium,inverted_order,
937,Billet Nantes Paris,Nantes,Paris,1,medium,no_markers,
2987,Je voyage avec Paris et Florence de Reims vers Annecy,Reims,Annecy,1,hard,name_ambiguity,Paris/Florence=prénoms
1256,Mon ami Lourdes m'attend à Le Havre je pars de Le Mans,Le Mans,Le Havre,1,medium,name_ambiguity,Lourdes=prénom
4392,Je souhaite me rendre à Strasbourg en partant de Bourg-en-Bresse,Bourg-en-Bresse,Strasbourg,1,medium,compound_name,compound name
7621,Un train de Bordeaux pour Strasbourg,Bordeaux,Strasbourg,1,easy,standard,
5372,Combien coûte un billet de Toulon à Toulouse,Toulon,Toulouse,1,medium,additional_info,with time/passenger info
7662,Un billet de Salon-de-Provence pour Amiens,Salon-de-Provence,Amiens,1,medium,compound_name,compound name
249,À Nice,,,0,easy,incomplete_origin,missing origin
1479,Depuis Strasbourg ?,,,0,easy,incomplete_dest,missing destination
6326,Quel est le prix d'un aller simple de Saint-Étienne à Metz,Saint-Étienne,Metz,1,medium,additional_info,with time/passenger info
7439,À Dijon,,,0,easy,incomplete_origin,missing origin
105,Direction Strasbourg en partant de Tours,Tours,Strasbourg,1,medium,inverted_order,
4100,À quelle heure y a-t-il des trains de Lyon à Montpellier,Lyon,Montpellier,1,medium,standard,
1671,je souhaite me rendre a perpignan depuis lille,Lille,Perpignan,1,medium,no_capitals,"lowercase, no accents"
1948,Pour me rendre à Toulouse je pars de Dijon,Dijon,Toulouse,1,medium,inverted_order,
1962,Trajet de Toulouse vers Limoges,Toulouse,Limoges,1,easy,standard,
8697,"Avec mes amis Paris et Florence, je voudrais aller de Grenoble à Paris",Grenoble,Paris,1,hard,name_ambiguity,Paris/Florence=prénoms
1428,Pouvez-vous me réserver une place de Paris à Reims,Paris,Reims,1,medium,standard,
7799,Direction Marseille en partant de Perpignan,Perpignan,Marseille,1,medium,inverted_order,
7937,je dois aller à lyon ?,,,0,easy,incomplete_origin,missing origin
5151,Trajet vers Toulon ?,,,0,easy,incomplete_origin,missing origin
9546,Je veux aller de Angers à La Roche-sur-Yon,Angers,La Roche-sur-Yon,1,medium,compound_name,compound name
9483,Train pour Marseille Rennes et Nantes,,,0,medium,ambiguous,too many cities
6816,Je voudrais partir de Nantes à Bordeaux lundi prochain,Nantes,Bordeaux,1,medium,additional_info,with time/passenger info
3974,Billet Limoges Marseille,Limoges,Marseille,1,medium,no_markers,
3321,Je voyage avec Florence et Lourdes de Reims vers Annecy,Reims,Annecy,1,hard,name_ambiguity,Florence/Lourdes=prénoms
4093,Perpignan Toulon aujourd'hui,Perpignan,Toulon,1,medium,no_markers,
4161,je souhaite me rendre a toulon depui rennnes,Rennes,Toulon,1,hard,misspelling,spelling errors
4387,Mon ami Albert m'attend à Paris je pars de Nîmes,Nîmes,Paris,1,medium,name_ambiguity,Albert=prénom
1573,Je me rends à Amiens en provenance de Brest,Brest,Amiens,1,medium,inverted_order,
6819,Départ Le Mans arrivée Annecy,Le Mans,Annecy,1,easy,standard,
3809,Comment aller à Toulouse ?,,,0,easy,incomplete_origin,missing origin
6901,Je souhaite me rendre a Toure depui Le Maans,Le Mans,Tours,1,hard,misspelling,spelling errors
2801,Pouvez-vous me réserver une place de Le Havre à Paris,Le Havre,Paris,1,medium,standard,
3178,Je veux aller de Villeurbanne à Metz,Villeurbanne,Metz,1,easy,standard,
174,ordinateur sable baleine,,,0,easy,garbage,nonsense words
3436,En partant de Dijon ?,,,0,easy,incomplete_dest,missing destination
2361,je souhaite me rendre a bordo depui pari,Paris,Bordeaux,1,hard,misspelling,spelling errors
4410,je souhaite me rendre a tours depuis nice,Nice,Tours,1,medium,no_capitals,"lowercase, no accents"
1075,Un billet Brest Dijon pour 2 adultes,Brest,Dijon,1,medium,additional_info,with time/passenger info
5991,Avec mon ami Albert je voudrais aller de Marseille à Perpignan,Marseille,Perpignan,1,medium,name_ambiguity,Albert=prénom
8402,Je dois rejoindre Albert à Paris depuis Strasbourg,Strasbourg,Paris,1,medium,name_ambiguity,Albert=prénom
6723,Y a-t-il des trains directs de Amiens à Bordeaux,Amiens,Bordeaux,1,medium,standard,
3808,Y a-t-il des trains directs de Paris à Toulouse,Paris,Toulouse,1,medium,standard,
3110,À Villeurbanne en partance de Grenoble,Grenoble,Villeurbanne,1,medium,inverted_order,
860,Je suis actuellement à Grenoble,,,0,easy,incomplete_dest,missing destination
8468,Je vais à Perpignan voir mon ami Paris en partant de Aix-en-Provence,Aix-en-Provence,Perpignan,1,medium,name_ambiguity,Paris=prénom
2226,Quel est le train le plus rapide de Nice à Le Havre,Nice,Le Havre,1,hard,complex_question,
7292,@@## @@##,,,0,easy,garbage,special characters
5245,Je veux aller de Brest à Toulouse,Brest,Toulouse,1,easy,standard,
1435,Un billet Le Mans Nice pour 2 adultes,Le Mans,Nice,1,medium,additional_info,with time/passenger info
2760,Je vais de Montpellier à Nice à Lyon,,,0,medium,ambiguous,too many cities
2682,Je cherche un train de Tours à Marseille,Tours,Marseille,1,easy,standard,
5129,Je vais de Nantes à Toulouse à Lyon,,,0,medium,ambiguous,too many cities
7310,je voudrais un bilet de saint-étienn à marseile,Saint-Étienne,Marseille,1,hard,misspelling,spelling errors
6594,je veux aller de tours a toulouse,Tours,Toulouse,1,medium,no_capitals,"lowercase, no accents"
9292,j'aime lire des livres,,,0,easy,no_intent,off_topic
3975,Trajet de Tours vers Saint-Étienne,Tours,Saint-Étienne,1,easy,standard,
8303,Comment aller de Marseille à Rennes à Lyon,,,0,medium,ambiguous,too many cities
4395,@@## ... @@## ^^&&,,,0,easy,garbage,special characters
3227,trajet saint-étiennne reim,Saint-Étienne,Reims,1,hard,misspelling,spelling errors
5832,Je veux aller à Bordeaux en partant de Angers,Angers,Bordeaux,1,medium,inverted_order,
9249,Trajet vers Metz au départ de Toulon,Toulon,Metz,1,medium,inverted_order,
670,De Montpellier à Paris puis Nantes,,,0,medium,ambiguous,too many cities
7876,Y a-t-il un train de Lyon vers Perpignan,Lyon,Perpignan,1,easy,standard,
8666,basé à rennes,,,0,easy,incomplete_dest,missing destination
969,Je me trouve à Toulon,,,0,easy,incomplete_dest,missing destination
2001,Pouvez-vous me réserver une place de Saint-Étienne à Strasbourg,Saint-Étienne,Strasbourg,1,medium,standard,
2829,Strasbourg Metz demain,Strasbourg,Metz,1,medium,no_markers,
9980,Billet Toulon Nantes,Toulon,Nantes,1,medium,no_markers,
5981,Y a-t-il des trains directs de Paris à Amiens,Paris,Amiens,1,medium,standard,
3803,Coucou !,,,0,easy,no_intent,greetings
6016,Comment se rendre à Villeurbanne si on part de Le Havre,Le Havre,Villeurbanne,1,medium,inverted_order,
7775,Pouvez-vous me donner les horaires de Grenoble à Amiens,Grenoble,Amiens,1,easy,standard,
4241,les vacances approchent ?,,,0,easy,no_intent,off_topic
6924,Tours Marseille ce soir,Tours,Marseille,1,medium,no_markers,
8540,Vers Brest au départ de Aix-en-Provence,Aix-en-Provence,Brest,1,medium,inverted_order,
128,Je veux aller de Strasbourg à Bordeaux,Strasbourg,Bordeaux,1,easy,standard,
5516,un train de clermont-ferrand a villeurbanne,Clermont-Ferrand,Villeurbanne,1,medium,no_capitals,"lowercase, no accents"
5032,Pouvez-vous me donner les horaires de Tours à Limoges,Tours,Limoges,1,easy,standard,
1501,Comment aller de Bordeaux à Nantes à Nice,,,0,medium,ambiguous,too many cities
8242,Billet Nice Rennes Bordeaux,,,0,medium,ambiguous,too many cities
6587,Quel est le moyen le plus rapide pour aller de Grenoble à Lyon,Grenoble,Lyon,1,hard,complex_question,
230,henuvom kemyhowyb pumutezivi dor,,,0,easy,garbage,random text
786,Je quitte Strasbourg,,,0,easy,incomplete_dest,missing destination
4853,Comment aller de Nice à Nantes à Lyon,,,0,medium,ambiguous,too many cities
1512,de lille vers lyon,Lille,Lyon,1,medium,no_capitals,"lowercase, no accents"
7506,Trajet Bourg en Bresse Marseille,Bourg-en-Bresse,Marseille,1,medium,compound_name,compound name no hyphen
7758,"Avec mes amis Rémy et Albert, je voudrais aller de Villeurbanne à Amiens",Villeurbanne,Amiens,1,hard,name_ambiguity,Rémy/Albert=prénoms
5326,Y a-t-il des trains directs de Nîmes à Villeurbanne,Nîmes,Villeurbanne,1,medium,standard,
8066,"lourdes, paris et moi voulons aller de bordeaux à metz",Bordeaux,Metz,1,hard,name_ambiguity,"Lourdes/Paris=prénoms, lowercase"
7756,guitare guitare cactus cactus escalier,,,0,easy,garbage,nonsense words
8401,Un billet Lille Lyon s'il vous plaît,Lille,Lyon,1,easy,standard,
2866,Quand part le prochain train de Nantes vers Metz,Nantes,Metz,1,medium,standard,
6773,De Saint-Étienne vers Lille s'il vous plaît,Saint-Étienne,Lille,1,easy,standard,
6948,Avec mon ami Paris je voudrais aller de Clermont-Ferrand à Toulouse,Clermont-Ferrand,Toulouse,1,medium,name_ambiguity,Paris=prénom
427,Je voudrais aller à Nice,,,0,easy,incomplete_origin,missing origin
9848,Comment aller a Marseille depuis Lionne,Lyon,Marseille,1,hard,misspelling,spelling errors
6242,Je souhaite me rendre à Aix-les-Bains en partant de Le Mans,Le Mans,Aix-les-Bains,1,medium,compound_name,compound name
6888,Billet Paris Grenoble pour 3 personnes,Paris,Grenoble,1,medium,additional_info,with time/passenger info
4087,Bordeaux Montpellier Nantes Paris,,,0,medium,ambiguous,too many cities
5888,Trajet de Strasbourg vers Reims,Strasbourg,Reims,1,easy,standard,
2964,Marseille Le Mans ce soir,Marseille,Le Mans,1,medium,no_markers,
1664,Je vais à Reims voir mon ami Albert en partant de Saint-Étienne,Saint-Étienne,Reims,1,medium,name_ambiguity,Albert=prénom
7703,Un billet Dijon Bordeaux s'il vous plaît,Dijon,Bordeaux,1,easy,standard,
7837,comment aller a paric depuis rennnes,Rennes,Paris,1,hard,misspelling,spelling errors
