sentenceID,sentence,origin,destination,is_valid,difficulty,category,notes
7609,Pour aller à Bordeaux depuis Lyon,Lyon,Bordeaux,1,medium,inverted_order,
2825,Un billet Limoges Nîmes pour 2 adultes,Limoges,Nîmes,1,medium,additional_info,with time/passenger info
3614,Comment se rendre à Lille si on part de Toulouse,Toulouse,Lille,1,medium,inverted_order,
7470,Saint-Étienne Lyon ce soir,Saint-Étienne,Lyon,1,medium,no_markers,
2526,Cap sur Montpellier depuis Aix-en-Provence,Aix-en-Provence,Montpellier,1,medium,inverted_order,
5081,Quel est l'horaire des trains au départ de Annecy pour Dijon,Annecy,Dijon,1,medium,standard,
5788,Un billet Angers Lyon,Angers,Lyon,1,easy,no_markers,
1158,orange escalier fenêtre baleine valise baleine guitare,,,0,easy,garbage,nonsense words
6297,Je veux aller à Montpellier,,,0,easy,incomplete_origin,missing origin
5258,Je souhaite me rendre à Port-Boulet en partant de Le Mans,Le Mans,Port-Boulet,1,medium,compound_name,compound name
7138,Je souhaite me rendre à Lyon ?,,,0,easy,incomplete_origin,missing origin
3826,je voyage avec paris et clément de perpignan vers le havre,Perpignan,Le Havre,1,hard,name_ambiguity,"Paris/Clément=prénoms, lowercase"
486,vague tambour orange requin tambour papillon cactus requin,,,0,easy,garbage,nonsense words
5273,À quelle heure arrive le dernier train de Saint-Étienne à Nice,Saint-Étienne,Nice,1,medium,complex_question,
7605,Je voudrais un billet de Lyon à Villeurbanne,Lyon,Villeurbanne,1,easy,standard,
7494,Billet Grenoble Lyon,Grenoble,Lyon,1,medium,no_markers,
6373,Retrouver Albert à Tours en partant de Limoges,Limoges,Tours,1,hard,name_ambiguity,Albert=prénom
9714,Brest Angers aujourd'hui,Brest,Angers,1,medium,no_markers,
4588,"avec mes amis clément et rémy, je voudrais aller de angers à dijon",Angers,Dijon,1,hard,name_ambiguity,"Clément/Rémy=prénoms, lowercase"
7426,Trajet Toulouse La Roche sur Yon,Toulouse,La Roche-sur-Yon,1,medium,compound_name,compound name no hyphen
6801,Strasbourg Toulouse s'il vous plaît,Strasbourg,Toulouse,1,medium,no_markers,
9856,Dijon Le Mans aller simple,Dijon,Le Mans,1,medium,no_markers,
6992,sugu pepetilufu,,,0,easy,garbage,random text
7315,Départ Angers arrivée Paris,Angers,Paris,1,easy,standard,
5935,je veux aller de anger à montpelliier,Angers,Montpellier,1,hard,misspelling,spelling errors
3567,"avec mes amis albert et florence, je voudrais aller de strasbourg à perpignan",Strasbourg,Perpignan,1,hard,name_ambiguity,"Albert/Florence=prénoms, lowercase"
8827,Trajet vers Bordeaux au départ de Metz,Metz,Bordeaux,1,medium,inverted_order,
6076,Je quitte Bordeaux ?,,,0,easy,incomplete_dest,missing destination
1838,orange ordinateur cactus requin,,,0,easy,garbage,nonsense words
1264,Depuis Bordeaux,,,0,easy,incomplete_dest,missing destination
4171,Quand part le prochain train de Strasbourg vers Paris,Strasbourg,Paris,1,medium,standard,
5688,je voyage avec albert et rémy de saint-étienne vers aix-en-provence,Saint-Étienne,Aix-en-Provence,1,hard,name_ambiguity,"Albert/Rémy=prénoms, lowercase"
3044,Je souhaite me rendre à Clermont-Ferrand depuis Amiens,Amiens,Clermont-Ferrand,1,easy,standard,
1386,Je dois rejoindre Lourdes à Florence depuis Nice,Nice,Florence,1,medium,name_ambiguity,Lourdes=prénom
5944,trajet limoge bordo,Limoges,Bordeaux,1,hard,misspelling,spelling errors
145,Billet Nantes Nice Paris,,,0,medium,ambiguous,too many cities
3553,"Avec mes amis Florence et Albert, je voudrais aller de Montpellier à Nice",Montpellier,Nice,1,hard,name_ambiguity,Florence/Albert=prénoms
3529,"Rémy, Clément et moi voulons aller de Dijon à Toulouse",Dijon,Toulouse,1,hard,name_ambiguity,Rémy/Clément=prénoms
2087,Combien coûte un billet,,,0,easy,incomplete_grammar,grammatically incomplete
243,Un train de Saint-Étienne pour Nantes,Saint-Étienne,Nantes,1,easy,standard,
3357,je voyage avec albert et lourdes de saint-étienne vers annecy,Saint-Étienne,Annecy,1,hard,name_ambiguity,"Albert/Lourdes=prénoms, lowercase"
9417,Un train de Dijon pour Clermont-Ferrand,Dijon,Clermont-Ferrand,1,easy,standard,
9190,Un billet Toulon Montpellier s'il vous plaît,Toulon,Montpellier,1,easy,standard,
9264,Un billet Villeurbanne Saint-Étienne,Villeurbanne,Saint-Étienne,1,easy,no_markers,
9113,Quel est le prix d'un billet de Marseille à Annecy,Marseille,Annecy,1,easy,standard,
7033,Soit Nice soit Lyon,,,0,medium,ambiguous,contradictions
7847,@@@ 789 $$%% train Paris,,,0,easy,garbage,incoherent mix
7362,un billet montpellier saint-étienne s'il vous plait,Montpellier,Saint-Étienne,1,medium,no_capitals,"lowercase, no accents"
732,Je me trouve à Le Havre ?,,,0,easy,incomplete_dest,missing destination
3548,Combien coûte un billet de train de Reims à Nice,Reims,Nice,1,medium,standard,
7383,Je vais à Reims,,,0,easy,incomplete_origin,missing origin
6120,À Paris en partance de Amiens,Amiens,Paris,1,medium,inverted_order,
567,Je souhaite me rendre à Grenoble en partant de Aix-les-Bains,Aix-les-Bains,Grenoble,1,medium,compound_name,compound name
1253,De Limoges vers Lyon s'il vous plaît,Limoges,Lyon,1,easy,standard,
7337,Venant de Rennes,,,0,easy,incomplete_dest,missing destination
9244,Trajet Lyon Salon de Provence,Lyon,Salon-de-Provence,1,medium,compound_name,compound name no hyphen
1155,Un train pour Bordeaux,,,0,easy,incomplete_origin,missing origin
7127,456 train @@@,,,0,easy,garbage,incoherent mix
2904,J'adore danser,,,0,easy,no_intent,off_topic
7495,Quel est l'horaire des trains au départ de Brest pour Nîmes,Brest,Nîmes,1,medium,standard,
2178,"florence, paris et moi voulons aller de lille à villeurbanne",Lille,Villeurbanne,1,hard,name_ambiguity,"Florence/Paris=prénoms, lowercase"
2845,je souhaite me rendre a metz depui le man,Le Mans,Metz,1,hard,misspelling,spelling errors
8711,un billet montpellier amiens s'il vous plait,Montpellier,Amiens,1,medium,no_capitals,"lowercase, no accents"
5961,"avec mes amis lourdes et clément, je voudrais aller de le havre à paris",Le Havre,Paris,1,hard,name_ambiguity,"Lourdes/Clément=prénoms, lowercase"
2627,Trajet Brest Limoges,Brest,Limoges,1,medium,no_markers,
5384,je dois aller de lille a bordeaux,Lille,Bordeaux,1,medium,no_capitals,"lowercase, no accents"
1208,je souhaite me rendre a metz depui montpellier,Montpellier,Metz,1,hard,misspelling,spelling errors
5813,salut ça va,,,0,easy,no_intent,greetings
7955,Je souhaite me rendre a Reeims depui Annnecy,Annecy,Reims,1,hard,misspelling,spelling errors
7505,de angers vers lyon,Angers,Lyon,1,medium,no_capitals,"lowercase, no accents"
9885,Cap sur Le Mans depuis Nîmes,Nîmes,Le Mans,1,medium,inverted_order,
7672,Je voudrais un billet de Angers à Perpignan,Angers,Perpignan,1,easy,standard,
8904,orange requin nuage nougat orange framboise vague nougat,,,0,easy,garbage,nonsense words
2280,billet saint-étienne le havre,Saint-Étienne,Le Havre,1,medium,no_capitals,"lowercase, no accents"
8621,Trajet Lille Metz,Lille,Metz,1,medium,no_markers,
2628,je voudrais un bilet de bres à le havr,Brest,Le Havre,1,hard,misspelling,spelling errors
3041,je ne sais pas,,,0,easy,no_intent,random_statements
4230,Un billet Angers Amiens,Angers,Amiens,1,easy,no_markers,
4047,Pour aller à Amiens depuis Aix-en-Provence,Aix-en-Provence,Amiens,1,medium,inverted_order,
7960,Évidemment,,,0,easy,no_intent,random_statements
8209,crayon parapluie orange,,,0,easy,garbage,nonsense words
7985,Billet Lille Reims,Lille,Reims,1,medium,no_markers,
5720,Lille Reims aller simple,Lille,Reims,1,medium,no_markers,
78,j'aimerais visiter nantes,,,0,easy,incomplete_origin,missing origin
9693,billet nantes toulon,Nantes,Toulon,1,medium,no_capitals,"lowercase, no accents"
6481,je voyage avec lourdes et paris de perpignan vers dijon,Perpignan,Dijon,1,hard,name_ambiguity,"Lourdes/Paris=prénoms, lowercase"
8930,Commen aler de Brest a Toulouze,Brest,Toulouse,1,hard,misspelling,spelling errors
6260,Retrouver Lourdes à Perpignan en partant de Paris,Paris,Perpignan,1,hard,name_ambiguity,Lourdes=prénom
8121,un train de nantes a limoges,Nantes,Limoges,1,medium,no_capitals,"lowercase, no accents"
5368,Je voudrais partir de Strasbourg à Toulouse lundi prochain,Strasbourg,Toulouse,1,medium,additional_info,with time/passenger info
5595,Je quitte Toulon ?,,,0,easy,incomplete_dest,missing destination
7329,un billet angers paris s'il vous plait,Angers,Paris,1,medium,no_capitals,"lowercase, no accents"
8010,Avec mon ami Lourdes je voudrais aller de Brest à Montpellier,Brest,Montpellier,1,medium,name_ambiguity,Lourdes=prénom
8571,Pouvez-vous me réserver une place de Nantes à Perpignan,Nantes,Perpignan,1,medium,standard,
7571,de villeurbanne vers angers,Villeurbanne,Angers,1,medium,no_capitals,"lowercase, no accents"
7063,Pour me rendre à Aix-en-Provence je pars de Dijon,Dijon,Aix-en-Provence,1,medium,inverted_order,
5873,un billet montpellier brrest,Montpellier,Brest,1,hard,misspelling,spelling errors
4347,À Strasbourg en partance de Limoges,Limoges,Strasbourg,1,medium,inverted_order,
2450,Le Havre Montpellier aller simple,Le Havre,Montpellier,1,medium,no_markers,
9197,Je cherche un train de Lyon à Toulon,Lyon,Toulon,1,easy,standard,
7783,Trajet vers Montpellier au départ de Grenoble,Grenoble,Montpellier,1,medium,inverted_order,
1128,Vers Limoges au départ de Villeurbanne,Villeurbanne,Limoges,1,medium,inverted_order,
1602,Je veux aller à Villeurbanne en partant de Limoges,Limoges,Villeurbanne,1,medium,inverted_order,
9203,je voyage avec lourdes et florence de le havre vers clermont-ferrand,Le Havre,Clermont-Ferrand,1,hard,name_ambiguity,"Lourdes/Florence=prénoms, lowercase"
7346,Un billet Limoges Lille pour 2 adultes,Limoges,Lille,1,medium,additional_info,with time/passenger info
8214,@@## ...,,,0,easy,garbage,special characters
2840,De Lyon à Nantes ou peut-être Toulouse,,,0,medium,ambiguous,contradictions
8344,je voudrais un bilet de tolouse à diijon,Toulouse,Dijon,1,hard,misspelling,spelling errors
1631,Quel est le temps de trajet de Nice à Paris,Nice,Paris,1,medium,standard,
7774,je dois aller de nantes a toulouse,Nantes,Toulouse,1,medium,no_capitals,"lowercase, no accents"
3729,je voudrais un billet de limoges a angers,Limoges,Angers,1,medium,no_capitals,"lowercase, no accents"
4092,Pour aller à Le Mans depuis Perpignan,Perpignan,Le Mans,1,medium,inverted_order,
9306,"Avec mes amis Rémy et Florence, je voudrais aller de Dijon à Saint-Étienne",Dijon,Saint-Étienne,1,hard,name_ambiguity,Rémy/Florence=prénoms
4632,"Avec mes amis Lourdes et Albert, je voudrais aller de Metz à Florence",Metz,Florence,1,hard,name_ambiguity,Lourdes/Albert=prénoms
5428,Je dois rejoindre Rémy à Paris depuis Grenoble,Grenoble,Paris,1,medium,name_ambiguity,Rémy=prénom
7669,Where is the station,,,0,easy,garbage,foreign language
3921,Commen aler de Toulouze a Reim,Toulouse,Reims,1,hard,misspelling,spelling errors
4045,Combien coûte un billet de train de Toulon à Tours,Toulon,Tours,1,medium,standard,
7307,Quel est le prix d'un billet de Nîmes à Toulouse,Nîmes,Toulouse,1,easy,standard,
6276,À Le Havre en partance de Aix-en-Provence,Aix-en-Provence,Le Havre,1,medium,inverted_order,
9399,je voyage avec rémy et paris de tours vers aix-en-provence,Tours,Aix-en-Provence,1,hard,name_ambiguity,"Rémy/Paris=prénoms, lowercase"
10000,Quel est le temps de trajet de Lyon à Montpellier,Lyon,Montpellier,1,medium,standard,
4142,Je me rends à Marseille en provenance de Grenoble,Grenoble,Marseille,1,medium,inverted_order,
8640,Bilet Toulouze Le Havre,Toulouse,Le Havre,1,hard,misspelling,spelling errors
2919,j'ai rendez-vous chez le médecin,,,0,easy,no_intent,off_topic
62,Trajet de Nice vers Grenoble,Nice,Grenoble,1,easy,standard,
3863,Trajet de Nice vers Strasbourg,Nice,Strasbourg,1,easy,standard,
2536,Limoges Grenoble s'il vous plaît,Limoges,Grenoble,1,medium,no_markers,
7629,Je souhaite me rendre à Marseille depuis Metz,Metz,Marseille,1,easy,standard,
7600,De Lille à Nantes ou peut-être Lyon,,,0,medium,ambiguous,contradictions
7145,vague tambour cactus,,,0,easy,garbage,nonsense words
7290,je souhaite me rendre a strasbourg depui nîîmes,Nîmes,Strasbourg,1,hard,misspelling,spelling errors
3241,Billet Dijon Lyon,Dijon,Lyon,1,medium,no_markers,
77,jajodaciju vumi vot xyna vejel,,,0,easy,garbage,random text
2634,Un train pour Toulon,,,0,easy,incomplete_origin,missing origin
7144,Je veux aller à Lyon en partant de Bordeaux,Bordeaux,Lyon,1,medium,inverted_order,
8825,Je voudrais un bilet de Paric à Nice,Paris,Nice,1,hard,misspelling,spelling errors
9801,Un aller simple de Strasbourg à Montpellier,Strasbourg,Montpellier,1,easy,standard,
6981,Je veux aller de Amiens à Reims demain matin,Amiens,Reims,1,medium,additional_info,with time/passenger info
2700,Je voudrais un billet de Villeurbanne à Saint-Étienne pour demain,Villeurbanne,Saint-Étienne,1,medium,additional_info,with time/passenger info
9960,je veux aller de lyo à perpigna,Lyon,Perpignan,1,hard,misspelling,spelling errors
7365,Je voyage avec Lourdes et Albert de Annecy vers Florence,Annecy,Florence,1,hard,name_ambiguity,Lourdes/Albert=prénoms
4833,Comment aller à Saint-Étienne depuis Amiens,Amiens,Saint-Étienne,1,medium,compound_name,compound name
6293,Je voyage avec Florence et Clément de Annecy vers Florence,Annecy,Florence,1,hard,name_ambiguity,Florence/Clément=prénoms
9422,En partant de Angers ?,,,0,easy,incomplete_dest,missing destination
8331,De Annecy vers Grenoble s'il vous plaît,Annecy,Grenoble,1,easy,standard,
4543,Départ Perpignan arrivée Clermont-Ferrand,Perpignan,Clermont-Ferrand,1,easy,standard,
6695,bilet rennes reiims,Rennes,Reims,1,hard,misspelling,spelling errors
5490,je veux aller de toulo à strasbour,Toulon,Strasbourg,1,hard,misspelling,spelling errors
5566,Pour aller à Limoges depuis Grenoble,Grenoble,Limoges,1,medium,inverted_order,
7242,trajet lyon saint-étiennne,Lyon,Saint-Étienne,1,hard,misspelling,spelling errors
1360,À quelle heure y a-t-il des trains de Aix-en-Provence à Reims,Aix-en-Provence,Reims,1,medium,standard,
1853,les oiseaux chantent ?,,,0,easy,no_intent,random_statements
6184,Arrivant de Angers,,,0,easy,incomplete_dest,missing destination
3245,Un billet Rennes Bordeaux,Rennes,Bordeaux,1,easy,no_markers,
5965,Trajet Boulogne-sur-Mer Nice,Boulogne-sur-Mer,Nice,1,medium,compound_name,compound name
5950,Pour me rendre à Nantes je pars de Toulon,Toulon,Nantes,1,medium,inverted_order,
1392,Tours Nantes s'il vous plaît,Tours,Nantes,1,medium,no_markers,
4918,trajet metz strasbourg,Metz,Strasbourg,1,medium,no_capitals,"lowercase, no accents"
9681,"Avec mes amis Paris et Albert, je voudrais aller de Annecy à Dijon",Annecy,Dijon,1,hard,name_ambiguity,Paris/Albert=prénoms
9036,Pouvez-vous me donner les horaires de Annecy à Saint-Étienne,Annecy,Saint-Étienne,1,easy,standard,
6957,horaire de train ?,,,0,easy,incomplete_grammar,grammatically incomplete
6013,Un train de Tours pour Dijon,Tours,Dijon,1,easy,standard,
9754,sable igloo guitare cactus sable escalier uniforme,,,0,easy,garbage,nonsense words
8984,Je veux aller de Tours à Lille,Tours,Lille,1,easy,standard,
9943,Je veux aller de Salon-de-Provence à Le Mans,Salon-de-Provence,Le Mans,1,medium,compound_name,compound name
7444,Paris Marseille Lyon Toulouse,,,0,medium,ambiguous,too many cities
8137,les tgv sont rapides,,,0,easy,no_intent,train_discussion
4187,Quelle est la durée du trajet de Angers à Paris,Angers,Paris,1,medium,complex_question,
6605,À Saint-Étienne en partance de Bordeaux,Bordeaux,Saint-Étienne,1,medium,inverted_order,
8727,Je veux visiter Nice Rennes Toulouse,,,0,medium,ambiguous,too many cities
6914,@@## $$%%,,,0,easy,garbage,special characters
8114,"Avec mes amis Rémy et Lourdes, je voudrais aller de Dijon à Marseille",Dijon,Marseille,1,hard,name_ambiguity,Rémy/Lourdes=prénoms
557,train ^^&& 123 @@@,,,0,easy,garbage,incoherent mix
7186,Bilet Amiens Nantess,Amiens,Nantes,1,hard,misspelling,spelling errors
6415,Je souhaite me rendre à Châlons-en-Champagne en partant de Nantes,Nantes,Châlons-en-Champagne,1,medium,compound_name,compound name
2531,Train de Bourg-en-Bresse à Tours,Bourg-en-Bresse,Tours,1,medium,compound_name,compound name
1004,Combien de correspondances entre Angers et Bordeaux,Angers,Bordeaux,1,hard,complex_question,
8352,Combien de correspondances entre Villeurbanne et Clermont-Ferrand,Villeurbanne,Clermont-Ferrand,1,hard,complex_question,
3169,Bilet Rennnes Marsel,Rennes,Marseille,1,hard,misspelling,spelling errors
6083,Billet Amiens Angers,Amiens,Angers,1,medium,no_markers,
4585,"rémy, albert et moi voulons aller de villeurbanne à le havre",Villeurbanne,Le Havre,1,hard,name_ambiguity,"Rémy/Albert=prénoms, lowercase"
1334,--- **!! ???,,,0,easy,garbage,special characters
3851,Je dois me rendre de Le Mans à Angers,Le Mans,Angers,1,easy,standard,
3425,un billet lille lyon s'il vous plait,Lille,Lyon,1,medium,no_capitals,"lowercase, no accents"
8328,je souhaite me rendre a dijon depuis nantes,Nantes,Dijon,1,medium,no_capitals,"lowercase, no accents"
5274,Quel est le temps de trajet de Montpellier à Clermont-Ferrand,Montpellier,Clermont-Ferrand,1,medium,standard,
2436,À Nice en partance de Reims,Reims,Nice,1,medium,inverted_order,
6955,je voyage avec clément et florence de montpellier vers annecy,Montpellier,Annecy,1,hard,name_ambiguity,"Clément/Florence=prénoms, lowercase"
3613,je veux aller de nantes a clermont-ferrand,Nantes,Clermont-Ferrand,1,medium,no_capitals,"lowercase, no accents"
4657,billet villeurbanne limoges,Villeurbanne,Limoges,1,medium,no_capitals,"lowercase, no accents"
596,Un aller simple de Dijon à Reims,Dijon,Reims,1,easy,standard,
8338,Le train de nuit est pratique,,,0,easy,no_intent,train_discussion
5068,jequpeq ludafocyty dyzare,,,0,easy,garbage,random text
7574,kayak parapluie lampe framboise,,,0,easy,garbage,nonsense words
2620,Billet Châlons en Champagne Saint Étienne,Châlons-en-Champagne,Saint-Étienne,1,medium,compound_name,compound name no hyphen
8407,un train de amiens a toulon,Amiens,Toulon,1,medium,no_capitals,"lowercase, no accents"
5820,Y a-t-il un train de Dijon vers Montpellier,Dijon,Montpellier,1,easy,standard,
817,Je pars de Bordeaux enfin non de Nantes,,,0,medium,ambiguous,conflicting information
3460,Bilet Nantez Tolouse,Nantes,Toulouse,1,hard,misspelling,spelling errors
9002,mon train est annulé,,,0,easy,no_intent,train_discussion
7617,je veux aller de reimms à marseille,Reims,Marseille,1,hard,misspelling,spelling errors
1493,Combien de temps faut-il pour aller de Saint-Étienne à Amiens,Saint-Étienne,Amiens,1,hard,complex_question,
5559,Angers Lille ce soir,Angers,Lille,1,medium,no_markers,
6266,de lille vers montpellier,Lille,Montpellier,1,medium,no_capitals,"lowercase, no accents"
7448,Mon ami Paris m'attend à Amiens je pars de Perpignan,Perpignan,Amiens,1,medium,name_ambiguity,Paris=prénom
5250,les rails de train sont fascinants ?,,,0,easy,no_intent,train_discussion
9398,Soit Bordeaux soit Rennes,,,0,medium,ambiguous,contradictions
2937,... voyage 123,,,0,easy,garbage,incoherent mix
1425,Cap sur Amiens depuis Lyon,Lyon,Amiens,1,medium,inverted_order,
7547,Comment aller a Bordeau depuis Reims,Reims,Bordeaux,1,hard,misspelling,spelling errors
7274,Pour aller à Clermont-Ferrand depuis Aix-en-Provence,Aix-en-Provence,Clermont-Ferrand,1,medium,inverted_order,
4164,"Albert, Clément et moi voulons aller de Saint-Étienne à Florence",Saint-Étienne,Florence,1,hard,name_ambiguity,Albert/Clément=prénoms
3569,Un billet Nice Paris s'il vous plaît,Nice,Paris,1,easy,standard,
6791,Un aller-retour Metz Angers pour la semaine prochaine,Metz,Angers,1,medium,additional_info,with time/passenger info
8455,Mon ami Lourdes m'attend à Paris je pars de Aix-en-Provence,Aix-en-Provence,Paris,1,medium,name_ambiguity,Lourdes=prénom
2275,Un train de Annecy pour Strasbourg,Annecy,Strasbourg,1,easy,standard,
880,Quel est l'horaire des trains au départ de Brest pour Limoges,Brest,Limoges,1,medium,standard,
4357,Un train de Strasbourg pour Lille,Strasbourg,Lille,1,easy,standard,
3307,Venant de Strasbourg,,,0,easy,incomplete_dest,missing destination
6061,Train Dijon Tours,Dijon,Tours,1,easy,no_markers,
9684,Pouvez-vous me réserver une place de Dijon à Nantes,Dijon,Nantes,1,medium,standard,
4758,Quel est le train le plus rapide de Strasbourg à Angers,Strasbourg,Angers,1,hard,complex_question,
5826,Soit Nantes soit Rennes,,,0,medium,ambiguous,contradictions
3716,Train pour Toulouse Bordeaux et Nantes,,,0,medium,ambiguous,too many cities
61,Train de Bourg en Bresse à Toulouse,Bourg-en-Bresse,Toulouse,1,medium,compound_name,compound name no hyphen
3232,Avec mon ami Lourdes je voudrais aller de Annecy à Florence,Annecy,Florence,1,medium,name_ambiguity,Lourdes=prénom
3263,je quitte nice,,,0,easy,incomplete_dest,missing destination
8808,je vais au cinéma ?,,,0,easy,no_intent,off_topic
8411,Je cherche un train de Brest à Nantes,Brest,Nantes,1,easy,standard,
4432,Billet Aix en Provence La Roche sur Yon,Aix-en-Provence,La Roche-sur-Yon,1,medium,compound_name,compound name no hyphen
3165,Vers Nice ?,,,0,easy,incomplete_origin,missing origin
3305,Salut ?,,,0,easy,no_intent,greetings
7487,igloo parapluie ordinateur nougat guitare baleine lampe,,,0,easy,garbage,nonsense words
5571,Je ne sais pas si Rennes ou Marseille,,,0,medium,ambiguous,contradictions
544,"clément, albert et moi voulons aller de tours à paris",Tours,Paris,1,hard,name_ambiguity,"Clément/Albert=prénoms, lowercase"
2558,je voudrais un bilet de saint-étienn à clermont--ferrand,Saint-Étienne,Clermont-Ferrand,1,hard,misspelling,spelling errors
4602,jeqaty hosynugiwu jyryv gel sufyh,,,0,easy,garbage,random text
3254,Peut-être Nantes ou bien Montpellier,,,0,medium,ambiguous,contradictions
322,un billet rennes marseille s'il vous plait,Rennes,Marseille,1,medium,no_capitals,"lowercase, no accents"
4429,Billet Metz Villeurbanne,Metz,Villeurbanne,1,medium,no_markers,
6623,Villeurbanne Saint-Étienne s'il vous plaît,Villeurbanne,Saint-Étienne,1,medium,no_markers,
1139,Direction Angers en partant de Bordeaux,Bordeaux,Angers,1,medium,inverted_order,
2514,Un aller-retour Rennes Paris pour la semaine prochaine,Rennes,Paris,1,medium,additional_info,with time/passenger info
2792,--- ^^&& $$%%,,,0,easy,garbage,special characters
4400,Je voudrais un billet de Perpignan à Toulouse,Perpignan,Toulouse,1,easy,standard,
4871,comment aller a le man depuis nîmmes,Nîmes,Le Mans,1,hard,misspelling,spelling errors
1537,Retrouver Albert à Lille en partant de Nîmes,Nîmes,Lille,1,hard,name_ambiguity,Albert=prénom
938,Je me trouve à Strasbourg,,,0,easy,incomplete_dest,missing destination
4186,Train Lyon Marseille,Lyon,Marseille,1,easy,no_markers,
9037,Mon départ est à Grenoble,,,0,easy,incomplete_dest,missing destination
31,Je voyage avec Albert et Rémy de Rennes vers Paris,Rennes,Paris,1,hard,name_ambiguity,Albert/Rémy=prénoms
2246,je ne comprends pas ?,,,0,easy,no_intent,random_statements
9971,À quelle heure part le premier train de Grenoble pour Reims,Grenoble,Reims,1,medium,complex_question,
8239,Je souhaite me rendre a Renne depui Nantez,Nantes,Rennes,1,hard,misspelling,spelling errors
2094,Je souhaite me rendre à Grenoble en partant de Châlons-en-Champagne,Châlons-en-Champagne,Grenoble,1,medium,compound_name,compound name
6363,Comment se rendre à Angers si on part de Tours,Tours,Angers,1,medium,inverted_order,
5141,Quand part le prochain train de Toulouse vers Angers,Toulouse,Angers,1,medium,standard,
1332,Train Clermont-Ferrand Metz,Clermont-Ferrand,Metz,1,easy,no_markers,
5449,crayon nougat framboise requin fenêtre framboise sable,,,0,easy,garbage,nonsense words
8881,Trajet vers Montpellier au départ de Lyon,Lyon,Montpellier,1,medium,inverted_order,
9918,Mon ami Rémy m'attend à Lille je pars de Grenoble,Grenoble,Lille,1,medium,name_ambiguity,Rémy=prénom
1813,Arrivant de Lyon ?,,,0,easy,incomplete_dest,missing destination
6619,Je vais au cinéma ?,,,0,easy,no_intent,off_topic
3249,La musique classique est relaxante !,,,0,easy,no_intent,off_topic
7940,Je vais à Le Havre voir mon ami Clément en partant de Nice,Nice,Le Havre,1,medium,name_ambiguity,Clément=prénom
143,Villeurbanne Perpignan ce soir,Villeurbanne,Perpignan,1,medium,no_markers,
1783,Y a-t-il des trains directs de Lille à Reims,Lille,Reims,1,medium,standard,
4619,tambour ordinateur requin valise jardin tambour,,,0,easy,garbage,nonsense words
2929,narydefore gegeqetipo paquf bomagama,,,0,easy,garbage,random text
8751,Comment aller a Annnecy depuis Bordo,Bordeaux,Annecy,1,hard,misspelling,spelling errors
9740,un train de tours a grenoble,Tours,Grenoble,1,medium,no_capitals,"lowercase, no accents"
5909,Un billet Limoges Nîmes s'il vous plaît,Limoges,Nîmes,1,easy,standard,
4637,je voudrais un bilet de montpellier à limoges,Montpellier,Limoges,1,hard,misspelling,spelling errors
215,Train Aix-en-Provence Montpellier,Aix-en-Provence,Montpellier,1,easy,no_markers,
9367,Je voyage avec Florence et Clément de Lille vers Brest,Lille,Brest,1,hard,name_ambiguity,Florence/Clément=prénoms
8283,je voudrais un bilet de le havre à lyo,Le Havre,Lyon,1,hard,misspelling,spelling errors
211,Trajet Villeurbanne Anneecy,Villeurbanne,Annecy,1,hard,misspelling,spelling errors
3031,Trajet vers Nantes au départ de Nice,Nice,Nantes,1,medium,inverted_order,
8810,quel est le prix pour ?,,,0,easy,incomplete_grammar,grammatically incomplete
23,je voyage avec albert et rémy de nantes vers annecy,Nantes,Annecy,1,hard,name_ambiguity,"Albert/Rémy=prénoms, lowercase"
2164,Mon ami Rémy m'attend à Paris je pars de Toulouse,Toulouse,Paris,1,medium,name_ambiguity,Rémy=prénom
4802,un train de marseille a paris,Marseille,Paris,1,medium,no_capitals,"lowercase, no accents"
1222,Je pars de Rennes enfin non de Montpellier,,,0,medium,ambiguous,conflicting information
3816,Clermont-Ferrand Montpellier ce soir,Clermont-Ferrand,Montpellier,1,medium,no_markers,
