sentenceID,sentence,origin,destination,is_valid,difficulty,category,notes
7877,Trajet vers Toulouse au départ de Saint-Étienne,Saint-Étienne,Toulouse,1,medium,inverted_order,
832,"Avec mes amis Florence et Albert, je voudrais aller de Clermont-Ferrand à Lille",Clermont-Ferrand,Lille,1,hard,name_ambiguity,Florence/Albert=prénoms
6929,Direction Dijon,,,0,easy,incomplete_origin,missing origin
5462,Un billet Clermont-Ferrand Dijon s'il vous plaît,Clermont-Ferrand,Dijon,1,easy,standard,
1236,Je vais de Bordeaux à Toulouse à Nice,,,0,medium,ambiguous,too many cities
5592,Je souhaite me rendre a Annnecy depui Aix-en--Provence,Aix-en-Provence,Annecy,1,hard,misspelling,spelling errors
1674,Départ Limoges arrivée Amiens,Limoges,Amiens,1,easy,standard,
5495,bilet nantes pari,Nantes,Paris,1,hard,misspelling,spelling errors
5082,Je veux aller de Toulon à Aix-en-Provence,Toulon,Aix-en-Provence,1,easy,standard,
3078,Pour me rendre à Toulon je pars de Clermont-Ferrand,Clermont-Ferrand,Toulon,1,medium,inverted_order,
8291,Aix-en-Provence Le Mans aujourd'hui,Aix-en-Provence,Le Mans,1,medium,no_markers,
9180,Pour me rendre à Lille je pars de Perpignan,Perpignan,Lille,1,medium,inverted_order,
1736,Billet Angers Villeurbanne,Angers,Villeurbanne,1,medium,no_markers,
684,rukiqimog ruviw wyjejumy gyhuwyny,,,0,easy,garbage,random text
1450,trajet clermont-ferrand grenoble,Clermont-Ferrand,Grenoble,1,medium,no_capitals,"lowercase, no accents"
9827,wywidezuna vutakopaz cure,,,0,easy,garbage,random text
9560,Lille Grenoble aujourd'hui,Lille,Grenoble,1,medium,no_markers,
6783,à marseille ?,,,0,easy,incomplete_origin,missing origin
392,"Avec mes amis Lourdes et Rémy, je voudrais aller de Perpignan à Florence",Perpignan,Florence,1,hard,name_ambiguity,Lourdes/Rémy=prénoms
6934,comment aller a limogees depuis grenobl,Grenoble,Limoges,1,hard,misspelling,spelling errors
595,Un aller-retour ?,,,0,easy,incomplete_grammar,grammatically incomplete
8882,Je me trouve à Grenoble,,,0,easy,incomplete_dest,missing destination
5438,un aller simple ?,,,0,easy,incomplete_grammar,grammatically incomplete
3632,Je cherche un train de Clermont-Ferrand à Saint-Étienne,Clermont-Ferrand,Saint-Étienne,1,easy,standard,
384,Cap sur Lyon depuis Grenoble,Grenoble,Lyon,1,medium,inverted_order,
3203,"rémy, lourdes et moi voulons aller de toulouse à le mans",Toulouse,Le Mans,1,hard,name_ambiguity,"Rémy/Lourdes=prénoms, lowercase"
2752,Quel est le prix d'un billet de Reims à Rennes,Reims,Rennes,1,easy,standard,
9549,comment aller a angers depuis lill,Lille,Angers,1,hard,misspelling,spelling errors
4594,Je veux visiter Montpellier Rennes Nice,,,0,medium,ambiguous,too many cities
3861,Départ Strasbourg arrivée Le Havre,Strasbourg,Le Havre,1,easy,standard,
9189,Mon ami Rémy m'attend à Rennes je pars de Reims,Reims,Rennes,1,medium,name_ambiguity,Rémy=prénom
8656,Un billet Grenoble Limoges s'il vous plaît,Grenoble,Limoges,1,easy,standard,
7185,Deux billets de Perpignan à Toulon s'il vous plaît,Perpignan,Toulon,1,medium,additional_info,with time/passenger info
8211,De Montpellier à Marseille ou peut-être Paris,,,0,medium,ambiguous,contradictions
2915,joja tuwesimos geceko,,,0,easy,garbage,random text
6653,Pour aller à Paris depuis Brest,Brest,Paris,1,medium,inverted_order,
2082,Un aller simple de Paris à Strasbourg,Paris,Strasbourg,1,easy,standard,
2690,Je souhaite me rendre à Clermont-Ferrand depuis Toulon,Toulon,Clermont-Ferrand,1,easy,standard,
6670,je voudrais un bilet de strasbour à le mans,Strasbourg,Le Mans,1,hard,misspelling,spelling errors
4945,Retrouver Clément à Paris en partant de Bordeaux,Bordeaux,Paris,1,hard,name_ambiguity,Clément=prénom
8842,Billet Amiens Paris,Amiens,Paris,1,medium,no_markers,
3035,"Avec mes amis Rémy et Albert, je voudrais aller de Aix-en-Provence à Tours",Aix-en-Provence,Tours,1,hard,name_ambiguity,Rémy/Albert=prénoms
9007,Billet Rennes Marseille Nice,,,0,medium,ambiguous,too many cities
6635,Pour aller à Bordeaux depuis Villeurbanne,Villeurbanne,Bordeaux,1,medium,inverted_order,
4335,À Lyon,,,0,easy,incomplete_origin,missing origin
8959,un billet pour toulouse ?,,,0,easy,incomplete_origin,missing origin
5224,Un billet Paris Nîmes,Paris,Nîmes,1,easy,no_markers,
4920,"avec mes amis florence et clément, je voudrais aller de brest à angers",Brest,Angers,1,hard,name_ambiguity,"Florence/Clément=prénoms, lowercase"
3926,Pour aller à Nice depuis Toulon,Toulon,Nice,1,medium,inverted_order,
2433,Origine Paris,,,0,easy,incomplete_dest,missing destination
9368,Route pour Paris,,,0,easy,incomplete_origin,missing origin
9444,Y a-t-il un train de Nîmes vers Grenoble,Nîmes,Grenoble,1,easy,standard,
9944,Je dois rejoindre Paris à Nice depuis Reims,Reims,Nice,1,medium,name_ambiguity,Paris=prénom
9575,Je veux aller à Toulon en partant de Lille,Lille,Toulon,1,medium,inverted_order,
6038,Deux billets de Limoges à Marseille s'il vous plaît,Limoges,Marseille,1,medium,additional_info,with time/passenger info
8319,de saint-étienne vers angers,Saint-Étienne,Angers,1,medium,no_capitals,"lowercase, no accents"
2778,Trajet de Metz vers Toulon,Metz,Toulon,1,easy,standard,
4514,Marseille Toulouse aller simple,Marseille,Toulouse,1,medium,no_markers,
4352,À quelle heure y a-t-il des trains de Bordeaux à Lyon,Bordeaux,Lyon,1,medium,standard,
9018,Quel est le temps de trajet de Tours à Bordeaux,Tours,Bordeaux,1,medium,standard,
316,Je pars de Paris enfin non de Toulouse,,,0,medium,ambiguous,conflicting information
1914,Un aller simple de Marseille à Nîmes,Marseille,Nîmes,1,easy,standard,
291,Un billet Brest Le Havre s'il vous plaît,Brest,Le Havre,1,easy,standard,
4419,De Limoges vers Châlons-en-Champagne,Limoges,Châlons-en-Champagne,1,medium,compound_name,compound name
1820,comment aller a reim depuis aix-en-provence,Aix-en-Provence,Reims,1,hard,misspelling,spelling errors
962,Train pour Paris Bordeaux et Lyon,,,0,medium,ambiguous,too many cities
4863,Je veux aller de Aix en Provence à Saint Étienne,Aix-en-Provence,Saint-Étienne,1,medium,compound_name,compound name no hyphen
9110,je veux aller de aix-en-provenc à amiens,Aix-en-Provence,Amiens,1,hard,misspelling,spelling errors
483,Reims Angers ce soir,Reims,Angers,1,medium,no_markers,
3050,Je cherche un train de Clermont-Ferrand à Nîmes,Clermont-Ferrand,Nîmes,1,easy,standard,
7741,un billet saint-étienne villeurbanne s'il vous plait,Saint-Étienne,Villeurbanne,1,medium,no_capitals,"lowercase, no accents"
2383,Un billet de Boulogne sur Mer pour Nantes,Boulogne-sur-Mer,Nantes,1,medium,compound_name,compound name no hyphen
6504,Billet Lille Paris Marseille,,,0,medium,ambiguous,too many cities
8735,Bilet Anger Dijo,Angers,Dijon,1,hard,misspelling,spelling errors
2360,je voyage avec lourdes et florence de lille vers montpellier,Lille,Montpellier,1,hard,name_ambiguity,"Lourdes/Florence=prénoms, lowercase"
1080,Je suis à Montpellier ?,,,0,easy,incomplete_dest,missing destination
4245,À Grenoble en partance de Angers,Angers,Grenoble,1,medium,inverted_order,
7496,Je vais à Saint-Étienne voir mon ami Clément en partant de Amiens,Amiens,Saint-Étienne,1,medium,name_ambiguity,Clément=prénom
5095,tirotyr pozu,,,0,easy,garbage,random text
2349,Un aller simple de Tours à Clermont-Ferrand,Tours,Clermont-Ferrand,1,easy,standard,
386,Deux billets de Lille à Nîmes s'il vous plaît,Lille,Nîmes,1,medium,additional_info,with time/passenger info
2333,Je cherche un train de Grenoble à Lyon,Grenoble,Lyon,1,easy,standard,
6745,Retrouver Rémy à Nice en partant de Tours,Tours,Nice,1,hard,name_ambiguity,Rémy=prénom
3107,Bordeaux Toulouse Nantes Lille,,,0,medium,ambiguous,too many cities
4951,Rennes Marseille Nantes Paris,,,0,medium,ambiguous,too many cities
7071,De Dijon vers Saint Étienne,Dijon,Saint-Étienne,1,medium,compound_name,compound name no hyphen
7355,Bilet Nices Nantez,Nice,Nantes,1,hard,misspelling,spelling errors
7402,Un train pour Strasbourg,,,0,easy,incomplete_origin,missing origin
7504,Je quitte Marseille,,,0,easy,incomplete_dest,missing destination
2973,Je cherche un train de Dijon à Metz,Dijon,Metz,1,easy,standard,
7357,Je souhaite me rendre à La Roche sur Yon en partant de Limoges,Limoges,La Roche-sur-Yon,1,medium,compound_name,compound name no hyphen
1465,Y a-t-il un train de Brest vers Dijon,Brest,Dijon,1,easy,standard,
7786,À quelle heure y a-t-il des trains de Clermont-Ferrand à Nice,Clermont-Ferrand,Nice,1,medium,standard,
8224,Comment aller de Metz à Nantes,Metz,Nantes,1,easy,standard,
3166,je souhaite me rendre a clermont-ferrand depuis amiens,Amiens,Clermont-Ferrand,1,medium,no_capitals,"lowercase, no accents"
8661,--- ...,,,0,easy,garbage,special characters
9854,je voudrais un billet de amiens a annecy,Amiens,Annecy,1,medium,no_capitals,"lowercase, no accents"
3595,un billet clermont-ferrand montpellier s'il vous plait,Clermont-Ferrand,Montpellier,1,medium,no_capitals,"lowercase, no accents"
1085,Je souhaite me rendre à Aix les Bains en partant de Aix en Provence,Aix-en-Provence,Aix-les-Bains,1,medium,compound_name,compound name no hyphen
3700,Je voudrais réserver un billet de Dijon pour Limoges,Dijon,Limoges,1,medium,standard,
3784,Un billet Paris Nantes pour ce soir,Paris,Nantes,1,medium,additional_info,with time/passenger info
3259,Avec mon ami Rémy je voudrais aller de Angers à Le Havre,Angers,Le Havre,1,medium,name_ambiguity,Rémy=prénom
4287,Un train de Amiens pour Rennes,Amiens,Rennes,1,easy,standard,
9535,je dois aller de bordeaux a lyon,Bordeaux,Lyon,1,medium,no_capitals,"lowercase, no accents"
7396,Quel est le temps de trajet de Nice à Metz,Nice,Metz,1,medium,standard,
3985,Quel est le prix d'un aller simple de Amiens à Rennes,Amiens,Rennes,1,medium,additional_info,with time/passenger info
5617,Un billet Le Mans Rennes s'il vous plaît,Le Mans,Rennes,1,easy,standard,
4912,À quelle heure arrive le dernier train de Dijon à Toulouse,Dijon,Toulouse,1,medium,complex_question,
47,Je voudrais un billet de Nîmes à Paris,Nîmes,Paris,1,easy,standard,
8720,Trajet Nantes Annecy,Nantes,Annecy,1,medium,no_markers,
9266,uniforme escalier tambour valise jardin requin lampe jardin,,,0,easy,garbage,nonsense words
6336,Je veux visiter Rennes Toulouse Lyon,,,0,medium,ambiguous,too many cities
3109,Combien coûte un billet de Perpignan à Rennes,Perpignan,Rennes,1,medium,additional_info,with time/passenger info
8818,À Amiens en partance de Aix-en-Provence,Aix-en-Provence,Amiens,1,medium,inverted_order,
2903,Comment se rendre à Brest si on part de Paris,Paris,Brest,1,medium,inverted_order,
6469,Cap sur Grenoble,,,0,easy,incomplete_origin,missing origin
7856,Venant de Bordeaux,,,0,easy,incomplete_dest,missing destination
8198,Je souhaite me rendre à Paris en partant de La Roche sur Yon,La Roche-sur-Yon,Paris,1,medium,compound_name,compound name no hyphen
3127,la mer est belle ?,,,0,easy,no_intent,off_topic
2645,Je me suis trompé Montpellier pas Rennes,,,0,medium,ambiguous,conflicting information
5509,commen aler de amien a nante,Amiens,Nantes,1,hard,misspelling,spelling errors
1839,À quelle heure y a-t-il des trains de Nantes à Aix-en-Provence,Nantes,Aix-en-Provence,1,medium,standard,
547,Un aller simple de Saint-Étienne à Marseille,Saint-Étienne,Marseille,1,easy,standard,
8459,Je vais à Florence voir mon ami Lourdes en partant de Montpellier,Montpellier,Florence,1,medium,name_ambiguity,Lourdes=prénom
7216,Origine Toulouse ?,,,0,easy,incomplete_dest,missing destination
6426,!!! **!!,,,0,easy,garbage,special characters
4700,De Bordeaux à Rennes ou peut-être Lyon,,,0,medium,ambiguous,contradictions
1467,voyage Paris --- @@@,,,0,easy,garbage,incoherent mix
9547,À Toulon en partance de Tours,Tours,Toulon,1,medium,inverted_order,
170,Enchanté,,,0,easy,no_intent,greetings
4877,je veux aller de nîmes a toulon,Nîmes,Toulon,1,medium,no_capitals,"lowercase, no accents"
8220,"florence, lourdes et moi voulons aller de montpellier à le havre",Montpellier,Le Havre,1,hard,name_ambiguity,"Florence/Lourdes=prénoms, lowercase"
7763,Commen aler de Strasbour a Toulouse,Strasbourg,Toulouse,1,hard,misspelling,spelling errors
1257,"avec mes amis rémy et paris, je voudrais aller de toulon à perpignan",Toulon,Perpignan,1,hard,name_ambiguity,"Rémy/Paris=prénoms, lowercase"
1261,Commen aler de Annecy a Nices,Annecy,Nice,1,hard,misspelling,spelling errors
1534,Je voudrais un billet de Reims à Nice,Reims,Nice,1,easy,standard,
306,Billet Le Mans Châlons-en-Champagne,Le Mans,Châlons-en-Champagne,1,medium,compound_name,compound name
8750,À Toulouse en partance de Dijon,Dijon,Toulouse,1,medium,inverted_order,
9448,"Clément, Albert et moi voulons aller de Aix-en-Provence à Perpignan",Aix-en-Provence,Perpignan,1,hard,name_ambiguity,Clément/Albert=prénoms
6212,départ toulon,,,0,easy,incomplete_dest,missing destination
2809,Je cherche un train de Dijon à Nantes,Dijon,Nantes,1,easy,standard,
1881,Direction Nice en partant de Toulouse,Toulouse,Nice,1,medium,inverted_order,
1156,guitare crayon fenêtre valise framboise orange ordinateur orange,,,0,easy,garbage,nonsense words
3874,"clément, rémy et moi voulons aller de tours à toulon",Tours,Toulon,1,hard,name_ambiguity,"Clément/Rémy=prénoms, lowercase"
1052,de clermont-ferrand vers tours,Clermont-Ferrand,Tours,1,medium,no_capitals,"lowercase, no accents"
9289,Comment aller à Nîmes depuis Port-Boulet,Port-Boulet,Nîmes,1,medium,compound_name,compound name
658,Un billet Metz Bordeaux s'il vous plaît,Metz,Bordeaux,1,easy,standard,
4379,trajet rennes marseille,Rennes,Marseille,1,medium,no_capitals,"lowercase, no accents"
1915,... ... ??? **!!,,,0,easy,garbage,special characters
7501,Billet Lille Bordeaux Paris,,,0,medium,ambiguous,too many cities
9151,Trajet de Bordeaux vers Strasbourg,Bordeaux,Strasbourg,1,easy,standard,
2430,Avec mon ami Albert je voudrais aller de Angers à Paris,Angers,Paris,1,medium,name_ambiguity,Albert=prénom
4772,En direction de Paris,,,0,easy,incomplete_origin,missing origin
6505,Direction Brest en partant de Paris,Paris,Brest,1,medium,inverted_order,
1212,Je dois rejoindre Rémy à Aix-en-Provence depuis Perpignan,Perpignan,Aix-en-Provence,1,medium,name_ambiguity,Rémy=prénom
7868,Un billet Angers Limoges s'il vous plaît,Angers,Limoges,1,easy,standard,
2102,Je dois rejoindre Rémy à Amiens depuis Le Havre,Le Havre,Amiens,1,medium,name_ambiguity,Rémy=prénom
8269,Train pour Nantes Toulouse et Lille,,,0,medium,ambiguous,too many cities
2630,Vers Strasbourg au départ de Reims,Reims,Strasbourg,1,medium,inverted_order,
5297,Je dois rejoindre Clément à Paris depuis Tours,Tours,Paris,1,medium,name_ambiguity,Clément=prénom
1170,Je dois rejoindre Albert à Limoges depuis Metz,Metz,Limoges,1,medium,name_ambiguity,Albert=prénom
9058,la montagne c'est beau ?,,,0,easy,no_intent,off_topic
6301,Je veux aller à Reims en partant de Lille,Lille,Reims,1,medium,inverted_order,
6489,Je souhaite me rendre à Marseille depuis Lille,Lille,Marseille,1,easy,standard,
9280,je souhaite me rendre a paris depui le mans,Le Mans,Paris,1,hard,misspelling,spelling errors
761,Pour Lyon ?,,,0,easy,incomplete_origin,missing origin
6822,Je voudrais aller à Reims,,,0,easy,incomplete_origin,missing origin
1104,Comment aller à Aix-les-Bains depuis Tours,Tours,Aix-les-Bains,1,medium,compound_name,compound name
1123,voyage Lyon 456 $$%%,,,0,easy,garbage,incoherent mix
7146,Quel est le prix d'un billet de Limoges à Nice,Limoges,Nice,1,easy,standard,
991,Pouvez-vous me réserver une place de Aix-en-Provence à Grenoble,Aix-en-Provence,Grenoble,1,medium,standard,
8586,Je souhaite me rendre à Paris en partant de Port Boulet,Port-Boulet,Paris,1,medium,compound_name,compound name no hyphen
7009,trajet rennes dijon,Rennes,Dijon,1,hard,misspelling,spelling errors
5656,Vers Montpellier au départ de Annecy,Annecy,Montpellier,1,medium,inverted_order,
8480,Comment aller de Lyon à Toulouse à Rennes,,,0,medium,ambiguous,too many cities
2961,un train de le mans a bordeaux,Le Mans,Bordeaux,1,medium,no_capitals,"lowercase, no accents"
8149,Avec mon ami Lourdes je voudrais aller de Lyon à Paris,Lyon,Paris,1,medium,name_ambiguity,Lourdes=prénom
9909,je voyage avec paris et florence de le mans vers tours,Le Mans,Tours,1,hard,name_ambiguity,"Paris/Florence=prénoms, lowercase"
9004,De Lyon à Nantes puis Marseille,,,0,medium,ambiguous,too many cities
203,Je veux aller à Toulouse en partant de Marseille,Marseille,Toulouse,1,medium,inverted_order,
744,cap sur lille,,,0,easy,incomplete_origin,missing origin
4105,commen aler de lill a angerrs,Lille,Angers,1,hard,misspelling,spelling errors
8609,Trajet Marseille Amiens,Marseille,Amiens,1,medium,no_markers,
502,Quel est le temps de trajet de Brest à Nantes,Brest,Nantes,1,medium,standard,
4403,De Lille vers Lille,,,0,medium,ambiguous,origin equals destination
5878,"avec mes amis paris et clément, je voudrais aller de toulon à paris",Toulon,Paris,1,hard,name_ambiguity,"Paris/Clément=prénoms, lowercase"
2917,Je souhaite me rendre à Nice depuis Limoges,Limoges,Nice,1,easy,standard,
9327,À Reims,,,0,easy,incomplete_origin,missing origin
5680,je voudrais un bilet de nantess à toullon,Nantes,Toulon,1,hard,misspelling,spelling errors
3403,basé à nantes ?,,,0,easy,incomplete_dest,missing destination
2834,mon chat est mignon ?,,,0,easy,no_intent,off_topic
3876,Lille Angers aujourd'hui,Lille,Angers,1,medium,no_markers,
9022,Je pars pour Dijon ?,,,0,easy,incomplete_origin,missing origin
2993,Je souhaite me rendre à Paris en partant de Châlons en Champagne,Châlons-en-Champagne,Paris,1,medium,compound_name,compound name no hyphen
3515,framboise lampe uniforme vague cactus kayak uniforme,,,0,easy,garbage,nonsense words
4148,je veux aller de strasbourrg à perpigna,Strasbourg,Perpignan,1,hard,misspelling,spelling errors
1439,Je pars de Toulouse enfin non de Lyon,,,0,medium,ambiguous,conflicting information
3115,Je dois me rendre de Nîmes à Perpignan,Nîmes,Perpignan,1,easy,standard,
8222,De Bordeaux à Montpellier puis Nantes,,,0,medium,ambiguous,too many cities
5979,le train c'est mieux que l'avion ?,,,0,easy,no_intent,train_discussion
6368,fenêtre orange crayon cactus vague guitare vague vague,,,0,easy,garbage,nonsense words
7399,Je souhaite me rendre a Clermont-Ferrand depui Villleurbanne,Villeurbanne,Clermont-Ferrand,1,hard,misspelling,spelling errors
5790,Pouvez-vous me réserver une place de Limoges à Dijon,Limoges,Dijon,1,medium,standard,
5346,Les locomotives sont puissantes,,,0,easy,no_intent,train_discussion
7475,voyage Paris !!! 456,,,0,easy,garbage,incoherent mix
7445,Billet Limoges Clermont-Ferrand,Limoges,Clermont-Ferrand,1,medium,no_markers,
4640,Train de Le Havre à Aix-les-Bains,Le Havre,Aix-les-Bains,1,medium,compound_name,compound name
4957,je veux aller de marseille a metz,Marseille,Metz,1,medium,no_capitals,"lowercase, no accents"
875,Quel est l'horaire des trains au départ de Lyon pour Lille,Lyon,Lille,1,medium,standard,
6189,Trajet Grrenoble Marsel,Grenoble,Marseille,1,hard,misspelling,spelling errors
9859,Combien coûte un billet de train de Aix-en-Provence à Marseille,Aix-en-Provence,Marseille,1,medium,standard,
629,Je vais à Annecy voir mon ami Clément en partant de Le Havre,Le Havre,Annecy,1,medium,name_ambiguity,Clément=prénom
7570,Un train de Lyon pour Perpignan,Lyon,Perpignan,1,easy,standard,
6702,un train de aix-en-provence a reims,Aix-en-Provence,Reims,1,medium,no_capitals,"lowercase, no accents"
4655,De Marseille non attendez de Bordeaux vers Toulouse,,,0,medium,ambiguous,conflicting information
4510,bien sûr,,,0,easy,no_intent,random_statements
3123,Basé à Marseille,,,0,easy,incomplete_dest,missing destination
858,un billet perpignan nantez,Perpignan,Nantes,1,hard,misspelling,spelling errors
7705,Quel est l'horaire des trains au départ de Amiens pour Dijon,Amiens,Dijon,1,medium,standard,
5126,Comment aller à Rennes ?,,,0,easy,incomplete_origin,missing origin
2579,Je dois me rendre de Lyon à Saint-Étienne,Lyon,Saint-Étienne,1,easy,standard,
5636,Je quitte Dijon ?,,,0,easy,incomplete_dest,missing destination
2952,Direction Saint-Étienne en partant de Nantes,Nantes,Saint-Étienne,1,medium,inverted_order,
9388,Quel est l'horaire des trains au départ de Dijon pour Metz,Dijon,Metz,1,medium,standard,
737,Je dois rejoindre Florence à Paris depuis Lyon,Lyon,Paris,1,medium,name_ambiguity,Florence=prénom
4178,De Annecy vers Villeurbanne s'il vous plaît,Annecy,Villeurbanne,1,easy,standard,
2790,Basé à Rennes ?,,,0,easy,incomplete_dest,missing destination
7735,De Aix-les-Bains vers Dijon,Aix-les-Bains,Dijon,1,medium,compound_name,compound name
1268,À quelle heure y a-t-il des trains de Montpellier à Annecy,Montpellier,Annecy,1,medium,standard,
1711,zixi cycu gop sytu dikugyvos,,,0,easy,garbage,random text
6925,Trajet Annec Limoges,Annecy,Limoges,1,hard,misspelling,spelling errors
9446,Pour aller à Marseille depuis Nantes,Nantes,Marseille,1,medium,inverted_order,
4722,Mon départ est à Nice,,,0,easy,incomplete_dest,missing destination
7372,À quelle heure part le premier train de Brest pour Nice,Brest,Nice,1,medium,complex_question,
7660,Un train de Metz pour Limoges,Metz,Limoges,1,easy,standard,
9947,Rennes Saint-Étienne ce soir,Rennes,Saint-Étienne,1,medium,no_markers,
2545,Je pars de Angers,,,0,easy,incomplete_dest,missing destination
6941,wigedocyba qawiquq jod revicyhago,,,0,easy,garbage,random text
6739,je veux aller à toulouse,,,0,easy,incomplete_origin,missing origin
8423,De Lyon vers Strasbourg s'il vous plaît,Lyon,Strasbourg,1,easy,standard,
1984,Cap sur Le Mans depuis Lyon,Lyon,Le Mans,1,medium,inverted_order,
3145,Je veux aller de Lille à Perpignan,Lille,Perpignan,1,easy,standard,
8844,Avec mon ami Albert je voudrais aller de Nice à Le Mans,Nice,Le Mans,1,medium,name_ambiguity,Albert=prénom
4038,Direction Brest en partant de Strasbourg,Strasbourg,Brest,1,medium,inverted_order,
6868,Trajet vers Aix-en-Provence au départ de Montpellier,Montpellier,Aix-en-Provence,1,medium,inverted_order,
1478,Yo !,,,0,easy,no_intent,greetings
7416,Commen aler de Marseile a Toullon,Marseille,Toulon,1,hard,misspelling,spelling errors
4359,miroir kayak cactus parapluie tambour papillon crayon papillon,,,0,easy,garbage,nonsense words
573,Mon ami Rémy m'attend à Paris je pars de Annecy,Annecy,Paris,1,medium,name_ambiguity,Rémy=prénom
542,Quel est le prix d'un billet de Reims à Limoges,Reims,Limoges,1,easy,standard,
8535,À Grenoble en partance de Metz,Metz,Grenoble,1,medium,inverted_order,
9501,Y a-t-il un train de Toulon vers Bordeaux,Toulon,Bordeaux,1,easy,standard,
6436,Billet pour,,,0,easy,incomplete_grammar,grammatically incomplete
4575,Y a-t-il des trains directs de Clermont-Ferrand à Perpignan,Clermont-Ferrand,Perpignan,1,medium,standard,
3274,Je cherche un train de Nîmes à Dijon,Nîmes,Dijon,1,easy,standard,
7338,je dois aller de rennes a metz,Rennes,Metz,1,medium,no_capitals,"lowercase, no accents"
394,trajet vers le havre,,,0,easy,incomplete_origin,missing origin
2509,Un train de Nice pour Angers,Nice,Angers,1,easy,standard,
2864,Route pour Le Havre ?,,,0,easy,incomplete_origin,missing origin
4285,Je me rends à Rennes en provenance de Metz,Metz,Rennes,1,medium,inverted_order,
591,Avez-vous des enfants ?,,,0,easy,no_intent,general_questions
2016,retrouver lourdes à lyon en partant de perpignan,Perpignan,Lyon,1,hard,name_ambiguity,"Lourdes=prénom, lowercase"
5121,Quelle belle journée !,,,0,easy,no_intent,off_topic
804,Je souhaite me rendre à Toulon en partant de La Roche-sur-Yon,La Roche-sur-Yon,Toulon,1,medium,compound_name,compound name
7466,Dijon Marseille ce soir,Dijon,Marseille,1,medium,no_markers,
3292,Quel est le prix d'un billet de Annecy à Metz,Annecy,Metz,1,easy,standard,
1758,train train train train train train train,,,0,easy,garbage,repetitions
8862,Les trains à grande vitesse impressionnent !,,,0,easy,no_intent,train_discussion
8625,Départ Paris arrivée Toulon,Paris,Toulon,1,easy,standard,
874,Comment aller de Toulouse à Toulon,Toulouse,Toulon,1,easy,standard,
7078,Toulouse Nîmes demain,Toulouse,Nîmes,1,medium,no_markers,
4794,Je souhaite me rendre à Brest depuis Reims,Reims,Brest,1,easy,standard,
7370,Quel est l'horaire des trains au départ de Dijon pour Toulon,Dijon,Toulon,1,medium,standard,
7304,mon départ est à montpellier ?,,,0,easy,incomplete_dest,missing destination
6257,Un billet Aix-en-Provence Lille s'il vous plaît,Aix-en-Provence,Lille,1,easy,standard,
6346,Je voudrais un bilet de Touloon à Nîmmes,Toulon,Nîmes,1,hard,misspelling,spelling errors
8846,papillon sable fenêtre igloo,,,0,easy,garbage,nonsense words
8492,Billet Nice Nice,,,0,medium,ambiguous,origin equals destination
1299,Combien coûte un billet de Metz à Tours,Metz,Tours,1,medium,additional_info,with time/passenger info
747,Avec mon ami Clément je voudrais aller de Le Havre à Paris,Le Havre,Paris,1,medium,name_ambiguity,Clément=prénom
9467,La mer est belle ?,,,0,easy,no_intent,off_topic
6965,À Dijon en partance de Strasbourg,Strasbourg,Dijon,1,medium,inverted_order,
7454,Deux billets de Bordeaux à Perpignan s'il vous plaît,Bordeaux,Perpignan,1,medium,additional_info,with time/passenger info
9274,Avec mon ami Rémy je voudrais aller de Metz à Le Havre,Metz,Le Havre,1,medium,name_ambiguity,Rémy=prénom
9892,Je me rends à Dijon en provenance de Amiens,Amiens,Dijon,1,medium,inverted_order,
2305,À Tours en partance de Aix-en-Provence,Aix-en-Provence,Tours,1,medium,inverted_order,
2249,Trajet de Annecy vers Grenoble,Annecy,Grenoble,1,easy,standard,
9118,Je pars demain de,,,0,easy,incomplete_grammar,grammatically incomplete
2543,Retrouver Albert à Villeurbanne en partant de Saint-Étienne,Saint-Étienne,Villeurbanne,1,hard,name_ambiguity,Albert=prénom
2042,Un billet Rennes Nice s'il vous plaît,Rennes,Nice,1,easy,standard,
5308,Comment aller de Lyon à Limoges,Lyon,Limoges,1,easy,standard,
1410,raluj fojojy focyxaso tavyc xovexegaq,,,0,easy,garbage,random text
